{
  "headline": "A mesma copia muda de nome conforme o que você faz com ela depois.",
  "mechanism_steps": [
    "Todo artista começa copiando. Picasso desenhava réplicas de mestres por horas pra entender o traço. Austin Kleon: imitar é o primeiro andar da escada criativa.",
    "Mas tem dois jeitos de copiar. Um é replicar pra estudar como funciona, depois fazer sua versão com aquela técnica e citar a referência. O outro é copiar, esconder a fonte e entregar como seu.",
    "O divisor não é o ato de copiar — é a citação e o que você faz depois. Copia + estudo + sua versão + crédito = aprendiz. Copia + esconder + entregar igual = ladrão. Mesmo Ctrl+C, dois caminhos."
  ],
  "illustration_hint": "Duas crianças desenhando uma mesma cena. Esquerda: olha pro modelo, replica observando, com etiqueta 'estudando, depois faço o meu'. Direita: arranca a folha do modelo e cola no caderno escondendo a fonte. Mesma cópia, dois caminhos opostos.",
  "micro_check": {
    "question": "{{learner_name}} viu um desenho incrível no Instagram, copiou o estilo, fez seu proprio personagem com aquele tracejado e postou. Quando isso vira aprendizado em vez de roubo?",
    "options": [
      "Quando posta sem dizer nada — se ninguém reclamar, tá valendo.",
      "Quando estuda a técnica, faz sua versão com personagem diferente E credita ('inspirado em @artista').",
      "Quando muda só a cor do desenho original e posta como seu.",
      "Quando pede permissão por DM antes de copiar."
    ],
    "correct_index": 1,
    "rationale": "Copiar pra estudar técnica e parte do aprendizado — todo artista faz. O que separa aprendiz de ladrão e: sua versão tem algo seu, e você credita de quem aprendeu. Sem crédito e sem versão propria, copia vira plagio."
  }
}