{
  "headline": "Promessa cumprida vira cola invisível entre pessoas.",
  "mechanism_steps": [
    "Você promete algo e o cérebro da outra pessoa monta uma expectativa — 'ela vai fazer X'.",
    "Quando você cumpre, o cérebro dela dispara um 'deu certo' e guarda: 'essa pessoa é confiável'.",
    "Cada promessa cumprida cola mais essa etiqueta — e a confiança cresce invisível, sem você perceber."
  ],
  "illustration_hint": "Duas pessoas lado a lado; entre elas, uma linha invisível que se torna mais grossa e brilhante a cada promessa cumprida (representada por um selo de 'ok').",
  "micro_check": {
    "question": "{{learner_name}} prometeu ao {{sibling_or_friend}} que ia emprestar um jogo, mas esqueceu. O que acontece com a confiança?",
    "options": [
      "A confiança não muda, porque foi sem querer.",
      "A confiança perde um pouco da força, mas pode ser reconstruída com novas promessas cumpridas.",
      "A confiança some para sempre.",
      "A confiança só existe se a promessa for grande."
    ],
    "correct_index": 1,
    "rationale": "Confiança não é tudo ou nada — ela se constrói aos poucos. Um esquecimento não destrói tudo, mas mostra que prometer exige cuidado. O legal é que dá pra reconstruir com novas promessas cumpridas."
  }
}