{
  "headline": "20% do que você faz rende 80% dos resultados. Escolha bem os 20%.",
  "mechanism_steps": [
    "De 100 tarefas que {{learner_name}} faz no dia, umas 20 concentram quase tudo que realmente importa — essas disparam os resultados grandes.",
    "As outras 80 parecem ocupadas, mas entregam pouco — cada uma empurra um resultado miúdo que quase não empurra o ponteiro.",
    "Se você achar as 20 e jogar mais esforço nelas, o resultado total sobe sem precisar fazer mais coisas — só trocou de alvo."
  ],
  "illustration_hint": "Ilustração de uma gangorra desbalanceada: do lado curto, 3 caixas pequenas com etiquetas coloridas \"20%\"; o lado longo está cheio de caixinhas cinza \"80%\". A gangorra pesa para o lado curto. Embaixo, um barbante liga as caixas coloridas a uma montanha de ouro no chão, e as caixas cinza a uma formiga.",
  "micro_check": {
    "question": "{{learner_name}} tem 14 figurinhas pra colar no álbum. 3 figurinhas são raríssimas e completam a página inteira; as outras 11 são repetidas e não ajudam em nada. O que o princípio de Pareto diria sobre isso?",
    "options": [
      "Cole todas na mesma velocidade, porque figurinha é figurinha.",
      "Foque nas 3 raras — elas dão quase todo o resultado da página.",
      "Jogue as repetidas fora, elas atrapalham.",
      "Troque as 11 repetidas por 11 novas e aí sim complete a página."
    ],
    "correct_index": 1,
    "rationale": "3 de 14 são ≈21% — bem perto dos 20% de Pareto. Essas 3 geram 100% do avanço na página. Focar nelas é escolher o 20% que entrega o 80%."
  }
}