{
  "headline": "Você treina seu cérebro a enxergar o que já estava ali",
  "mechanism_steps": [
    "Você decide notar algo bom (um sorriso, um dia de sol) e o cérebro arranca uma busca automática por mais coisas parecidas.",
    "Cada vez que acha outra coisa boa, o circuito de atenção reforça o caminho — você passa a reparar mais fácil na próxima.",
    "Com repetição, o filtro vira padrão: seu cérebro monta a cena do dia destacando o que deu certo, não o que faltou."
  ],
  "illustration_hint": "Ilustração de um olho humano com uma lente ajustável na íris; à esquerda, a lente está embaçada e só vê manchas cinzas; à direita, a lente está focada e revela pequenos pontos dourados espalhados pelo cenário. Uma mãozinha gira um botão escrito 'treino' entre as duas cenas.",
  "micro_check": {
    "question": "{{learner_name}} passou o dia reclamando que o recreio foi curto. Se ele treinar gratidão, o que muda na cabeça dele amanhã?",
    "options": [
      "Ele vai achar o recreio mais longo magicamente.",
      "Ele vai reparar que teve tempo de jogar duas partidas com o melhor amigo.",
      "Ele vai esquecer que o recreio existe.",
      "Ele vai odiar a escola."
    ],
    "correct_index": 1,
    "rationale": "Gratidão não muda os fatos — muda o que seu cérebro escolhe destacar. O recreio continua do mesmo tamanho, mas o filtro atencional treinado passa a notar o que estava lá (a partida com o amigo) em vez do que faltou."
  }
}