{
  "headline": "Cada repetição é voto em quem você é — não passo rumo a uma meta distante.",
  "mechanism_steps": [
    "Meta é um ponto no futuro: 'perder 5kg', 'tirar 9'. Quando atinge, acaba; quando falha, o cérebro arquiva como 'projeto morto' e o esforço desaparece junto.",
    "Hábito ligado à identidade arquiva diferente: cada repetição grava 'sou alguém que corre' na rede de auto-imagem, e o cérebro defende essa imagem como defende o próprio nome.",
    "Por isso quem para de fumar dizendo 'eu não fumo' segura mais que quem diz 'estou tentando parar' — o primeiro mudou a identidade; o segundo só está em projeto."
  ],
  "illustration_hint": "Duas crianças correndo. A da esquerda olha pra uma linha de chegada com cifrão '5kg' pendurada e o tronco curvado. A da direita olha pra frente com a camiseta escrita 'eu corro' brilhando no peito; debaixo dos pés, pequenas estampas de pegadas que se acendem uma a cada passo, formando um caminho de luz.",
  "micro_check": {
    "question": "{{learner_name}} quer ler mais. Qual frase ajuda mais o hábito a sobreviver depois do 30º dia?",
    "options": [
      "'Vou ler 30 minutos por dia até terminar o livro.'",
      "'Sou alguém que lê — então hoje abro o livro um pouco.'",
      "'Vou ler pra tirar 10 na próxima prova.'",
      "'Vou ler quando sobrar tempo entre as outras coisas.'"
    ],
    "correct_index": 1,
    "rationale": "A frase de identidade ('sou alguém que lê') grava no cérebro uma imagem do eu que continua valendo depois do livro acabar — meta e prêmio têm prazo de validade, identidade não."
  }
}
