{
  "headline": "DESC: Descrever + Expressar + Sugerir + Consequência. Pedidos viram diálogo, não ataque.",
  "mechanism_steps": [
    "Sharon Bower montou o DESC em 1976. A sacada: separar o fato (que ninguém discute) do sentimento (que é seu) — assim o outro não precisa se defender do fato antes de ouvir o pedido.",
    "Acusação direta ('você nunca me escuta!') ativa modo defesa no cérebro do outro — amígdala dispara, ele para de ouvir e parte pro contra-ataque. DESC mantém a conversa no córtex, onde dá pra negociar.",
    "Marshall Rosenberg fez parecido na Comunicação Não-Violenta: observação, sentimento, necessidade, pedido. Mesma engenharia — descrever o fato primeiro tira a armadura do outro."
  ],
  "illustration_hint": "Duas cenas lado a lado. Esquerda: criança gritando 'VOCÊ NUNCA ME ESCUTA!' e o outro com um escudo gigante na frente do peito, virando as costas. Direita: mesma criança falando calma — descrevendo, expressando, sugerindo — e o escudo do outro está no chão, mãos abertas, ouvindo.",
  "micro_check": {
    "question": "{{sibling_or_friend}} pegou a bicicleta do {{learner_name}} sem avisar de novo. Qual frase segue o DESC e tem mais chance de mudar o comportamento?",
    "options": [
      "'Você é um egoísta, sempre faz isso, nunca pensa em mim!'",
      "'Hoje pegou minha bici sem avisar (D). Fiquei chateado (E). Da próxima pergunta antes (S). Aí empresto numa boa (C).'",
      "'Tanto faz, faz o que quiser, nem ligo mais.'",
      "'Se você pegar de novo, vou contar tudo pros nossos pais agora mesmo.'"
    ],
    "correct_index": 1,
    "rationale": "A frase 2 segue o DESC inteiro: fato sem acusar, sentimento próprio, sugestão clara, consequência boa. Ataque direto (frase 1) ativa defesa no cérebro do outro e ele para de ouvir antes do pedido chegar."
  }
}
