{
  "headline": "Prêmio incerto vicia mais que prêmio garantido — seu cérebro paga atenção pela chance.",
  "mechanism_steps": [
    "Você faz algo e o cérebro espera um prêmio; se o prêmio vem sempre igual, a expectativa morre.",
    "Quando o prêmio aparece de repente, sem aviso, o cérebro dispara um 'e se vier de novo?' — e você quer repetir.",
    "A incerteza mantém o sistema ligado: cada tentativa vira uma aposta que o cérebro não larga."
  ],
  "illustration_hint": "Ilustração de uma máquina de bolinhas: uma alavanca que às vezes solta uma bolinha dourada, às vezes não. Uma criança puxa a alavanca, olho arregalado, com um balão de pensamento mostrando um ponto de interrogação brilhante. Ao lado, uma máquina que sempre solta bolinha cinza — a criança bocejando.",
  "micro_check": {
    "question": "{{learner_name}} ganha um chocolate toda vez que arruma o quarto. Depois de uma semana, ele começa a achar chato. O que faria o cérebro dele ficar mais preso na tarefa?",
    "options": [
      "Ganhar um chocolate maior a cada arrumação.",
      "Ganhar um chocolate só de vez em quando, sem avisar quando.",
      "Ganhar dois chocolates toda vez.",
      "Ganhar um chocolate só no fim do mês."
    ],
    "correct_index": 1,
    "rationale": "O cérebro não vicia no tamanho do prêmio — vicia na incerteza. Quando o chocolate vem sempre igual, a expectativa morre. Quando vem de surpresa, o cérebro fica ligado na chance."
  }
}