{
  "headline": "Inflação é imposto que ninguém vota — mesmo dinheiro compra menos com o tempo.",
  "mechanism_steps": [
    "Quando o governo emite mais dinheiro do que cresce a produção, cada nota passa a valer um pouquinho menos. Em alguns anos, isso vira muito menos.",
    "Por isso o pão de 1 real da sua infância virou pão de 8 reais hoje — ninguém 'subiu o preço de propósito'. Cada real perdeu valor enquanto estava parado na sua carteira.",
    "Resultado: guardar dinheiro embaixo do colchão é perder devagar. Investir mesmo em renda fixa básica é só correr na mesma velocidade da inflação pra não encolher."
  ],
  "illustration_hint": "Uma cesta de pão em 2004 com 100 pães e R$100 do lado. Uma seta passa por cima do ano 2024 e a mesma cesta agora tem só 12 pães com os mesmos R$100 do lado, agora encolhidos como se fossem migalhas. Setinha embaixo: 'mesmo dinheiro, 8× menos comida'.",
  "micro_check": {
    "question": "{{learner_name}} ganhou R$1.000 e tem 2 opções: guardar embaixo do colchão por 10 anos OU colocar em poupança rendendo 6% ao ano. A inflação média foi de 5% ao ano. Qual a melhor escolha?",
    "options": [
      "Colchão — não rende mas o dinheiro tá seguro.",
      "Poupança — 6% > 5% de inflação, então o dinheiro ainda cresce um pouco em poder de compra.",
      "Gastar tudo agora porque vai perder valor.",
      "Tanto faz — R$1.000 são R$1.000 sempre."
    ],
    "correct_index": 1,
    "rationale": "Dinheiro parado é dinheiro encolhendo — inflação corrói. A poupança vence inflação por 1 ponto ao ano: pouco, mas não encolhe. O colchão perde sempre. Tesouro Direto rende ainda mais."
  }
}
