{
  "headline": "30 segundos de frio acordam mais que café — e o efeito dura horas.",
  "mechanism_steps": [
    "Um susto de frio (água gelada, mergulho, banho frio curto) faz o corpo entender 'situação importante' e libera noradrenalina — química do alerta — em 30 segundos.",
    "A noradrenalina sobe pra ~3× a base e fica circulando por algumas horas. Resultado: foco aumentado, sonolência sumida, raciocínio mais rápido — sem o crash que cafeína dá depois.",
    "Por isso atletas usam banho frio depois do treino (reduz inflamação) e antes de competição (acorda foco). Mesmo princípio, contextos diferentes."
  ],
  "illustration_hint": "Um chuveiro com duas torneiras: vermelha (quente) e azul brilhando. Uma criança vira a torneira azul por 30 segundos no fim do banho, com cronômetro marcando. Logo depois, pequenas faíscas elétricas saem do cérebro dela e os olhos abrem com expressão 'tô ligado'.",
  "micro_check": {
    "question": "{{learner_name}} tem prova em 1 hora e sente sono. Qual ação acorda mais sem dar crash depois?",
    "options": [
      "Tomar 2 copos de café forte.",
      "Terminar um banho de 5 min com 30 segundos de água fria.",
      "Comer um chocolate grande.",
      "Dar uma volta com o celular ouvindo música agitada."
    ],
    "correct_index": 1,
    "rationale": "30 segundos de frio acendem noradrenalina sem o ciclo sobe-desce da cafeína ou do açúcar. Foco dura horas e não tem crash. Cafeína e doce dão pico curto e queda."
  }
}
