{
  "headline": "Seu cérebro acha que raro é melhor (mesmo quando não é)",
  "mechanism_steps": [
    "Você vê algo difícil de conseguir — um brinquedo único na loja — e seu cérebro dispara um alerta: 'pode ser importante, decide rápido antes que outro pegue'.",
    "Esse sinal faz você prestar mais atenção naquilo e ignorar outras opções iguais que estão por perto — o cérebro monta uma fila de prioridade só pra ele.",
    "A sensação de 'quase perdendo' acelera a decisão: você escolhe antes de pensar se aquilo é realmente melhor — e nem sempre o que parece rápido é o melhor."
  ],
  "illustration_hint": "Cérebro estilizado com um pequeno triângulo amarelo de exclamação piscando ao lado, voltado pra uma prateleira que tem um único brinquedo iluminado; ao fundo, uma prateleira maior cheia do mesmo brinquedo apagada e desfocada, totalmente ignorada pelo olhar do cérebro.",
  "micro_check": {
    "question": "{{learner_name}} vê um anúncio: 'ÚLTIMA UNIDADE! Tênis voador edição limitada!'. O que o cérebro faz com essa informação?",
    "options": [
      "Dispara um sinal que diz 'isso pode ser importante' e faz você querer comprar sem comparar com outros tênis.",
      "Ignora completamente porque tênis não voam de verdade.",
      "Lembra que você já tem um tênis e decide não se importar.",
      "Faz você pesquisar todos os tênis voadores do mundo antes de decidir."
    ],
    "correct_index": 0,
    "rationale": "O cérebro não para pra checar se o tênis é bom ou se existem opções melhores — o 'sinal de escassez' acelera a decisão, fazendo você querer o raro antes de pensar se ele é realmente melhor."
  }
}