{
  "headline": "Mesmo fato vira histórias diferentes — dependendo do ângulo que mostra.",
  "mechanism_steps": [
    "Wilbur Schramm mapeou 5 grandes ângulos que jornal usa: herói/vítima, conflito, custo, culpa individual, culpa do sistema. Cada ângulo escolhe o que entra na manchete e o que fica de fora.",
    "Mesma chuva vira 3 manchetes: 'prefeitura abandona bairro' (sistema), 'moradores corajosos salvam vizinhos' (herói), 'chuva causa prejuízo de R$ 2 milhões' (custo). Fato igual, recorte muda tudo.",
    "Quem lê só 1 fonte recebe 1 ângulo achando que recebeu o fato cru. Comparar 3 fontes sobre o MESMO evento expõe o ângulo que cada uma escolheu — só aí dá pra montar o quadro inteiro."
  ],
  "illustration_hint": "Um mesmo prédio no centro, visto por três câmeras em ângulos diferentes. A da esquerda mostra só a fachada bonita iluminada. A do meio mostra um cano vazando atrás. A da direita mostra o prédio inteiro de longe, com o bairro em volta. Em cima de cada câmera, uma manchete diferente sobre 'o mesmo prédio'.",
  "micro_check": {
    "question": "Uma briga aconteceu na escola. {{learner_name}} quer entender o que rolou de verdade. Qual é o jeito mais honesto, segundo Schramm?",
    "options": [
      "Ler só a versão de quem estava do lado do {{learner_name}} — esses contam o fato direito.",
      "Comparar 3 versões diferentes sobre o MESMO momento e ver o que cada uma escolheu mostrar e esconder.",
      "Ler a versão de quem tem mais seguidores na escola — o mais popular sabe mais.",
      "Não ler nada e formar opinião sozinho do zero."
    ],
    "correct_index": 1,
    "rationale": "Schramm mostrou que cada fonte recorta a realidade num ângulo. 1 fonte = 1 ângulo disfarçado de fato. Comparar 3 versões do mesmo evento revela o que cada uma escondeu — é assim que se monta o quadro inteiro."
  }
}
