{
  "headline": "Uma caixa que engole algo, vira engrenagens, e cospe outra coisa.",
  "mechanism_steps": [
    "Algo entra na caixa — pode ser grão, dado, energia, sinal. A porta de entrada escolhe o que entra.",
    "Dentro, uma sequência de peças monta, quebra, ou transforma o que entrou — cada peça puxa a próxima.",
    "O resultado sai pela saída, e um sensor no final avisa a entrada se precisa ajustar o que entra."
  ],
  "illustration_hint": "Corte de uma caixa de engrenagens e correias: uma maçã inteira entra à esquerda, passa por lâminas que picam, uma esteira, e sai do outro lado como purê; uma seta de feedback volta de um sensor na saída para o funil de entrada, regulando a velocidade.",
  "micro_check": {
    "question": "Você regula a temperatura do chuveiro: sente a água quente e gira o registro pra esquerda. Qual parte é o feedback desse sistema?",
    "options": [
      "A água saindo do chuveiro.",
      "O cano que leva água quente até o chuveiro.",
      "Sua mão sentindo a temperatura e avisando se precisa girar mais.",
      "O registro que você gira."
    ],
    "correct_index": 2,
    "rationale": "Feedback é a 'volta' — seu tato sentiu o resultado (água quente) e ajustou a entrada (girar o registro). A saída sozinha não é feedback; só vira feedback quando mede e ajusta a entrada."
  }
}