{
  "headline": "Reclamar treina o cérebro a notar mais o que dá pra reclamar — o ruim cresce com a luz.",
  "mechanism_steps": [
    "Cada vez que você reclama, neurônios ligados àquele pensamento se conectam mais forte (neurônios que disparam juntos, ligam juntos). Repetir queixa treina o cérebro a achá-la pronta na próxima.",
    "Resultado: depois de muitas repetições, o cérebro caça automaticamente coisas pra reclamar — mesmo em situações boas, o filtro de 'o que tá errado' está afiado.",
    "Por isso reclamar não é só 'desabafar inocente': é prática. E a prática transforma você. Quem reclama todo dia em 6 meses está mais reclamão; quem reduz, fica mais leve — mesmo na mesma vida."
  ],
  "illustration_hint": "Duas paisagens idênticas (um jardim com flores e umas folhas secas). Na esquerda, lupa apontando pras folhas secas, com a frase 'sempre as folhas'. Na direita, mesma paisagem, lupa apontando pras flores. A mesma criança em ambos, mas o que vê é diferente. Setinha: 'a vista é treinada'.",
  "micro_check": {
    "question": "{{learner_name}} reclama todo dia de algo na escola. Qual o efeito mais provável depois de 3 meses?",
    "options": [
      "Vai resolver os problemas porque está expondo eles.",
      "Os professores vão prestar mais atenção e mudar.",
      "O cérebro vai ficar mais rápido em achar coisas pra reclamar, mesmo nos dias bons — e a escola vai parecer pior.",
      "Nada vai mudar — reclamar é só desabafo neutro."
    ],
    "correct_index": 2,
    "rationale": "Reclamação repetida é treino — o cérebro aprende a varrer o ambiente atrás de motivos pra queixa, e os bons momentos passam batidos. Não é 'só desabafo'; é prática que muda o filtro mental ao longo do tempo."
  }
}