{
  "headline": "Cada lembrança é reescrita — o cérebro inventa pra costurar buracos.",
  "mechanism_steps": [
    "Você vive uma cena; o cérebro não grava o filme inteiro, só arranca pedaços soltos (cheiro, cor, palavra) e joga em áreas diferentes.",
    "Na hora de lembrar, o cérebro puxa esses pedaços e monta um quebra-cabeça — mas se faltar peça, ele inventa uma que se encaixe.",
    "Essa peça inventada vira parte da lembrança; na próxima vez que você puxar, o cérebro monta de novo, com novos buracos e novas invenções."
  ],
  "illustration_hint": "Ilustração de um cérebro como arquivo bagunçado: gavetas abertas com pedaços de filme (um olho, uma risada, um tapete vermelho) voando; na mesa, um quebra-cabeça quase completo, mas uma peça faltando sendo desenhada por um lápis invisível.",
  "micro_check": {
    "question": "{{learner_name}} e {{sibling_or_friend}} discutiram ontem. Hoje, {{learner_name}} jura que o outro gritou primeiro, mas não tem certeza se ouviu direito. O que a memória reconstrutiva pode ter feito?",
    "options": [
      "Apagou completamente a briga da memória de {{learner_name}}.",
      "Inventou um grito que não existiu pra preencher o buraco de quem começou.",
      "Gravou a briga em câmera lenta, com todos os detalhes certos.",
      "Fez {{learner_name}} lembrar só do que comeu no café da manhã."
    ],
    "correct_index": 1,
    "rationale": "A memória reconstrutiva não apaga nem grava perfeito — ela monta cenas com pedaços e, quando falta um, inventa. O grito pode ser peça falsa que o cérebro costurou pra dar sentido."
  }
}