{
  "headline": "Internet e tinta, não giz — apagar do seu feed não apaga do mundo.",
  "mechanism_steps": [
    "Quando você posta uma foto, no instante seguinte ela está replicada: servidor principal guarda, faz backup, manda pra CDNs em outras cidades, gera miniaturas em vários tamanhos. Vira 5 ou 10 cópias.",
    "Além disso, qualquer pessoa que viu pode dar print, baixar, repostar em outro app ou salvar num bot que arquiva tudo. Cada uma dessas viagens cria mais uma cópia que você não controla.",
    "Quando você clica em 'apagar', a rede só remove a cópia DELA. As outras seguem firmes em prints, repostes e arquivos. Bruce Schneier, especialista em segurança, escreve: 'a internet não esquece'."
  ],
  "illustration_hint": "Criança clica 'apagar' numa foto de seu celular. A foto some da tela dela — mas atrás, num diagrama transparente, várias outras cópias dela permanecem brilhantes: servidor principal, CDN em 3 cidades, prints em celulares de amigos, arquivo de bot. A apagada é só uma.",
  "micro_check": {
    "question": "{{learner_name}} postou uma foto que se arrependeu e apagou 10 minutos depois. Por que isso Não garante que a foto sumiu da internet?",
    "options": [
      "Porque o app demora 24h pra apagar de verdade.",
      "Porque no instante do post a foto já virou várias copias — em backups, CDNs, prints e reposts que você não controla.",
      "Porque só apaga se você pagar a conta premium.",
      "Porque o Google já indexou e não deixa apagar."
    ],
    "correct_index": 1,
    "rationale": "Toda foto postada vira multiplas copias em segundos — backups do servico, CDNs, prints de gente, repostes, arquivos automaticos. Apertar 'apagar' só remove a copia daquele app. Às outras seguem firmes pelo mundo."
  }
}