{
  "headline": "Problema gigante vira monte de problema pequeno — é só dividir.",
  "mechanism_steps": [
    "Você pega um problema enorme (ex: 'arrumar o quarto') e arranca dele uma lista de pedaços menores: 'separar roupa suja', 'guardar livros', 'varrer o chão'.",
    "Cada pedaço pequeno dispara uma ação concreta — seu cérebro não trava mais, porque 'guardar livros' é fácil de começar.",
    "Você resolve um por um, e a soma dos pequenos resolvidos monta o problema gigante resolvido — sem ter enfrentado ele de uma vez."
  ],
  "illustration_hint": "Robô em estilo cartoon quebrando um bloco gigante cinza em cubos menores coloridos com um martelo; cada cubo carrega um pictograma diferente (livro, meia, vassoura, copo, brinquedo); ao lado, uma caixa aberta com checkmark verde grande estampado por fora recebendo os cubos.",
  "micro_check": {
    "question": "{{learner_name}} precisa fazer um trabalho de ciências enorme: 'construir um vulcão que entra em erupção'. Qual é o primeiro passo da decomposição?",
    "options": [
      "Pegar argila e fazer o vulcão de uma vez, torcendo pra dar certo.",
      "Dividir o trabalho em partes: 'fazer a base', 'misturar bicarbonato', 'testar a erupção'.",
      "Pedir pra {{sibling_or_friend}} fazer tudo sozinho.",
      "Desistir e fazer outro trabalho mais fácil."
    ],
    "correct_index": 1,
    "rationale": "Decompor é quebrar o problema gigante em pedaços resolvíveis um por um — 'fazer a base' é um pedaço pequeno que você começa agora, sem precisar encarar o vulcão inteiro."
  }
}